{
  "stage": "implementation-to-coding",
  "generatedAt": "2026-06-09",
  "sourceIntentGraphPath": "design/KG/SystemArchitecture.json",
  "summary": "Implementation Design audited Coding/Repair delivery for the remaining sec-e2e-027 lease-expiry active-defense gap. The frozen entrypoint tests/integration/security/test_audit_foundation.py::test_lease_expiry_blocks_untrusted_rejoin_until_gap_sync and protected harness tests/integration/security/harness.py remain intact, production repairs under deploy/api/store.py, src/qwenpaw/security/audit_foundation.py, and src/qwenpaw/app/routers/console.py now satisfy the block-first/release-after-proof contract, and focused, full explicit pytest, npm run test:argo, plus MCP runArchitectureTests all pass with design/KG/test-failure-records.json empty.",
  "implementationContracts": [
    "OVERALL_ARCHITECTURE.md",
    "src/qwenpaw/ARCHITECTURE.md",
    "src/qwenpaw/security/ARCHITECTURE.md",
    "src/qwenpaw/cli/ARCHITECTURE.md",
    "deploy/ARCHITECTURE.md",
    "deploy/api/ARCHITECTURE.md",
    "deploy/web/ARCHITECTURE.md",
    "tests/ARCHITECTURE.md",
    "tests/integration/security/ARCHITECTURE.md"
  ],
  "explicitEntrypoints": [
    {
      "testcaseName": "sec-e2e-024-end-to-end-non-repudiation-evidence-chain",
      "entryPath": "tests/integration/security/test_audit_foundation.py::test_end_to_end_non_repudiation_evidence_chain",
      "controlPoint": "Run the frozen real-app subprocess acceptance entrypoint: authenticate an employee, delegate a high-risk action through the agent/plugin/tool path, and provide the required confirmation through the protected harness.",
      "observationPoint": "Security Center and the audit query surface must expose a continuous user -> agent -> plugin -> tool evidence chain with a durable confirmation artifact digest and no anonymous or fallback-system identity link.",
      "initialExecutionStatus": "passed",
      "initialExecutionCommand": ".\\.venv\\Scripts\\python.exe -m pytest tests/unit/cli/test_cli_version.py::test_cli_version_option_outputs_current_version tests/unit/cli/test_cli_agents.py::test_agents_list_uses_shared_tool_helper tests/unit/cli/test_cli_task.py::test_task_command_registered_in_cli tests/unit/routers/test_settings.py::test_put_then_get_roundtrip tests/unit/routers/test_git.py::test_git_helper_uses_shared_command_runner tests/integration/security/test_audit_foundation.py::test_end_to_end_non_repudiation_evidence_chain tests/integration/security/test_audit_foundation.py::test_audit_integrity_self_healing_lockdown tests/integration/security/test_audit_foundation.py::test_lease_expiry_blocks_untrusted_rejoin_until_gap_sync tests/integration/security/test_audit_foundation.py::test_prompt_injection_cannot_bypass_high_risk_tool_guard -q"
    },
    {
      "testcaseName": "sec-e2e-025-audit-integrity-self-healing-lockdown",
      "entryPath": "tests/integration/security/test_audit_foundation.py::test_audit_integrity_self_healing_lockdown",
      "controlPoint": "Run the frozen real-app subprocess acceptance entrypoint: execute three high-risk actions to create a multi-record committed audit baseline, edit the second committed non-tail audit record by operating-system means while later records remain present, then attempt another high-risk action without manual trust recovery.",
      "observationPoint": "The system must detect historical-record ledger divergence before releasing the next high-risk boundary, raise one business-level data-continuity anomaly, enter local UNTRUSTED lock mode, refuse sensitive tooling, and keep the frozen Security Center backend plus operator-web observation surfaces recovery-required or UNTRUSTED rather than CLEAR until full-chain cloud validation succeeds.",
      "initialExecutionStatus": "passed",
      "initialExecutionCommand": ".\\.venv\\Scripts\\python.exe -m pytest tests/integration/security/test_audit_foundation.py::test_audit_integrity_self_healing_lockdown -q"
    },
    {
      "testcaseName": "sec-e2e-027-lease-expiry-active-defense",
      "entryPath": "tests/integration/security/test_audit_foundation.py::test_lease_expiry_blocks_untrusted_rejoin_until_gap_sync",
      "controlPoint": "Run the frozen real-app subprocess acceptance entrypoint: let a trusted client miss the lease window, observe denied rejoin before missing-gap verification, then drive the distinct recovery control point and restored-access attempt.",
      "observationPoint": "Security Center must mark the same canonical client UNTRUSTED after lease expiry, the pre-recovery console status must show denied rejoin before proof, the recovery control point must accept full-chain missing-gap validation, and the post-recovery trust projection plus console access must become ALIGNED or TRUSTED/200 only after continuity validation.",
      "initialExecutionStatus": "passed",
      "initialExecutionCommand": ".\\.venv\\Scripts\\python.exe -m pytest tests/unit/cli/test_cli_version.py::test_cli_version_option_outputs_current_version tests/unit/cli/test_cli_agents.py::test_agents_list_uses_shared_tool_helper tests/unit/cli/test_cli_task.py::test_task_command_registered_in_cli tests/unit/routers/test_settings.py::test_put_then_get_roundtrip tests/unit/routers/test_git.py::test_git_helper_uses_shared_command_runner tests/integration/security/test_audit_foundation.py::test_end_to_end_non_repudiation_evidence_chain tests/integration/security/test_audit_foundation.py::test_audit_integrity_self_healing_lockdown tests/integration/security/test_audit_foundation.py::test_lease_expiry_blocks_untrusted_rejoin_until_gap_sync tests/integration/security/test_audit_foundation.py::test_prompt_injection_cannot_bypass_high_risk_tool_guard -q"
    },
    {
      "testcaseName": "sec-e2e-021-prompt-injection-tool-guard-enforced",
      "entryPath": "tests/integration/security/test_audit_foundation.py::test_prompt_injection_cannot_bypass_high_risk_tool_guard",
      "controlPoint": "Run the frozen real-app subprocess acceptance entrypoint: submit nested deceptive instructions claiming test or maintenance mode while targeting a High risk tool without trusted provenance or confirmation.",
      "observationPoint": "The high-risk tool must remain blocked at the tool-call boundary, rejection must be recorded as durable security evidence with trace-bound nonce semantics, and Security Center/operator surfaces must expose the rejected attempt rather than silently executing.",
      "initialExecutionStatus": "passed",
      "initialExecutionCommand": ".\\.venv\\Scripts\\python.exe -m pytest tests/unit/cli/test_cli_version.py::test_cli_version_option_outputs_current_version tests/unit/cli/test_cli_agents.py::test_agents_list_uses_shared_tool_helper tests/unit/cli/test_cli_task.py::test_task_command_registered_in_cli tests/unit/routers/test_settings.py::test_put_then_get_roundtrip tests/unit/routers/test_git.py::test_git_helper_uses_shared_command_runner tests/integration/security/test_audit_foundation.py::test_end_to_end_non_repudiation_evidence_chain tests/integration/security/test_audit_foundation.py::test_audit_integrity_self_healing_lockdown tests/integration/security/test_audit_foundation.py::test_lease_expiry_blocks_untrusted_rejoin_until_gap_sync tests/integration/security/test_audit_foundation.py::test_prompt_injection_cannot_bypass_high_risk_tool_guard -q"
    }
  ],
  "criticalNonExplicitTests": [
    {
      "name": "security-audit-contract-boundaries",
      "path": "tests/architecture/security-audit-contract-boundaries.test.js",
      "kind": "architecture-boundary-guard",
      "controlPoint": "Read OVERALL_ARCHITECTURE.md, src/qwenpaw/security/ARCHITECTURE.md, deploy/ARCHITECTURE.md, deploy/api/ARCHITECTURE.md, deploy/web/ARCHITECTURE.md, tests/ARCHITECTURE.md, and tests/integration/security/ARCHITECTURE.md.",
      "observationPoint": "The guard proves the explicit security entrypoints remain owned by the runtime security boundary, separate Security Center deployment boundary, and tests architecture contract."
    },
    {
      "name": "security-explicit-entrypoint-traceability",
      "path": "tests/architecture/security-explicit-entrypoint-traceability.test.js",
      "kind": "explicit-entrypoint-correctness-guard",
      "controlPoint": "Read SystemArchitecture.json, ImplementationToCodingHandoff.json, test-failure-records.json, tests/integration/security/test_audit_foundation.py, and tests/integration/security/harness.py.",
      "observationPoint": "The guard proves security acceptanceCriteria, handoff entryPath, failure record path, GIVEN/WHEN/THEN markers, harness method names, and business failure category strings remain frozen for security explicit entrypoints."
    },
    {
      "name": "security-runtime-client-identity-boundary",
      "path": "tests/architecture/security-runtime-client-identity-boundary.test.js",
      "kind": "key-implementation-traceability-guard",
      "controlPoint": "Read src/qwenpaw/security/audit_foundation.py and deploy/api/store.py to compare the client id used by startup heartbeat against the client ids used by recovery, lockdown, and restored-access projection.",
      "observationPoint": "The guard proves one live runtime must use one canonical Security Center client id across heartbeat, recovery, lockdown, and restored-access projection."
    },
    {
      "name": "security-runtime-lease-persistence-boundary",
      "path": "tests/architecture/security-runtime-lease-persistence-boundary.test.js",
      "kind": "key-implementation-traceability-guard",
      "controlPoint": "Read deploy/api/app.py and deploy/api/store.py to confirm the recovery-handshake HTTP contract carries lease_ttl_seconds and the durable Security Center store writes last_heartbeat_at, lease_ttl_seconds, and lease_expires_at.",
      "observationPoint": "The guard proves sec-e2e-027 keeps durable lease persistence in the API/store seam and does not rely on projection-only fallback to hide zero lease fields."
    }